{
    "$schema": "field_actor.schema.json",
    "type": "sprite",
    "scene_node_type": 11,
    "shadow": true,
    "footprint_type": 0,
    "reflections": true,
    "billboard_size": 0,
    "sprite_atlas_size": 21,
    "sprite_controller_type": 13,
    "gender": null,
    "collision": {
        "width": 1,
        "height": 1
    },
    "offset": {
        "x": 0,
        "y": 0,
        "z": 0
    },
    "sprite": "OBJ_CODE_POKEMON_MASQUERAIN"
}
